{
  "$schema": "http://json-schema.org/draft-04/schema#",
  "title": "Drug",
  "description": "CTTV drug model",
  "type": "object",
  "version": "1.2",
  "properties": {
    "about": {
      "allOf": [
        {
          "$ref": "https://raw.githubusercontent.com/CTTV/json_schema/master/src/bioentity/bioentities.json"
        }
      ],
      "items": {
        "description": "An array of drug identifiers",
        "pattern": "^https://www.ebi.ac.uk/chembl/compound/inspect/CHEMBL[0-9]+$"
      }
    },
    "molecule_name": {
      "type": "string"
    },
    "molecule_type": {
      "type": "string"
    },
    "mechanism_of_action": {
      "type": "string"
    },
    "target_class": {
      "type": "array",
      "items": {
        "type": "string"
      }
    },
    "action_type": {
      "type": "string"
    }
  },
  "required": [
    "about"
  ],
  "additionalProperties": false
}